{
 "schema": 1,
 "name": "Selected release policy",
 "notes": "ConWIP cap 20 against immediate release.",
 "recording": {
  "attempt_id": "aaaaaaaaaaaaaaaaaaaaaaaaaaaaaaaa",
  "request_id": "bbbbbbbbbbbbbbbbbbbbbbbbbbbbbbbbbbbbbbbbbbbbbbbbbbbbbbbbbbbbbbbb",
  "trace_sha256": "dddddddddddddddddddddddddddddddddddddddddddddddddddddddddddddddd"
 },
 "layout": {
  "algorithms": {
   "auto": "layered-v1",
   "hash": "layout-hash-v1",
   "network": "network-v1"
  },
  "aliases": [
   {
    "address": {
     "i": 0,
     "j": 0,
     "kind": "lattice"
    },
    "canonical": {
     "i": 0,
     "j": 0,
     "kind": "lattice"
    }
   },
   {
    "address": {
     "i": 1,
     "j": 0,
     "kind": "lattice"
    },
    "canonical": {
     "i": 1,
     "j": 0,
     "kind": "lattice"
    }
   }
  ],
  "auto": {
   "algorithm": "layered-v1",
   "data": {
    "placements": {
     "layout:7b2269223a302c226a223a302c226b696e64223a226c617474696365227d": {
      "footprint": {
       "depth": 0.1,
       "height": 0,
       "width": 0.1
      },
      "kind": "node",
      "obstacle": false,
      "ports": {},
      "rotation": 0,
      "visual": {}
     },
     "layout:7b2269223a312c226a223a302c226b696e64223a226c617474696365227d": {
      "footprint": {
       "depth": 0.1,
       "height": 0,
       "width": 0.1
      },
      "kind": "node",
      "obstacle": false,
      "ports": {},
      "rotation": 0,
      "visual": {}
     },
     "station": {
      "footprint": {
       "depth": 1,
       "height": 0,
       "width": 1
      },
      "kind": "server",
      "obstacle": false,
      "ports": {},
      "rotation": 0,
      "visual": {}
     }
    },
    "schema_version": "1.0"
   },
   "derived_positions": {
    "layout:7b2269223a302c226a223a302c226b696e64223a226c617474696365227d": [
     0,
     0,
     0
    ],
    "layout:7b2269223a312c226a223a302c226b696e64223a226c617474696365227d": [
     2,
     0,
     0
    ]
   },
   "targets": {
    "layout:7b2269223a302c226a223a302c226b696e64223a226c617474696365227d": {
     "explicitly_placed": false,
     "graph_position": [
      0,
      0,
      0
     ],
     "kind": "node"
    },
    "layout:7b2269223a312c226a223a302c226b696e64223a226c617474696365227d": {
     "explicitly_placed": false,
     "graph_position": [
      2,
      0,
      0
     ],
     "kind": "node"
    },
    "station": {
     "explicitly_placed": true,
     "kind": "server"
    }
   },
   "topology": {
    "flows": [],
    "routings": [],
    "shopfloors": []
   }
  },
  "bindings": {},
  "dependencies": {
   "bindings": {},
   "queries": [
    {
     "code_count": 3,
     "descriptor": {
      "kind": "variant",
      "path": [
       "network"
      ]
     },
     "observed": {
      "state": "present",
      "value": "lattice"
     },
     "origin": "network",
     "targets": {
      "station": "server"
     }
    },
    {
     "code_count": 3,
     "descriptor": {
      "kind": "presence",
      "path": [
       "grid"
      ]
     },
     "observed": {
      "state": "present"
     },
     "origin": "network",
     "targets": {
      "station": "server"
     }
    },
    {
     "code_count": 3,
     "descriptor": {
      "kind": "presence",
      "path": [
       "network"
      ]
     },
     "observed": {
      "state": "present"
     },
     "origin": "network",
     "targets": {
      "station": "server"
     }
    },
    {
     "code_count": 3,
     "descriptor": {
      "kind": "value",
      "path": [
       "network"
      ]
     },
     "observed": {
      "eligible": true,
      "state": "present",
      "unset": [],
      "value": {
       "blocked": {},
       "bounds": [
        0,
        0,
        2,
        0
       ],
       "capacity": 2,
       "clearance": 0,
       "direction": "both",
       "enabled": true,
       "neighbors": 4,
       "type": "lattice"
      }
     },
     "origin": "network",
     "targets": {
      "station": "server"
     }
    },
    {
     "code_count": 3,
     "descriptor": {
      "kind": "value",
      "path": [
       "grid"
      ]
     },
     "observed": {
      "eligible": true,
      "state": "present",
      "unset": [],
      "value": {
       "dx": 2,
       "dy": 2,
       "origin": [
        0,
        0,
        0
       ]
      }
     },
     "origin": "network",
     "targets": {
      "station": "server"
     }
    },
    {
     "code_count": 3,
     "descriptor": {
      "kind": "selection",
      "path": [
       "placements"
      ],
      "predicate": "obstacle"
     },
     "observed": {
      "flags": {
       "station": {
        "state": "absent",
        "value": null
       }
      },
      "members": [
       "station"
      ],
      "selected": [],
      "state": "present"
     },
     "origin": "network",
     "targets": {
      "layout:7b2269223a302c226a223a302c226b696e64223a226c617474696365227d": "node",
      "layout:7b2269223a312c226a223a302c226b696e64223a226c617474696365227d": "node",
      "station": "server"
     }
    },
    {
     "code_count": 3,
     "descriptor": {
      "kind": "selection",
      "path": [
       "placements"
      ],
      "predicate": "connector"
     },
     "observed": {
      "flags": {
       "station": {
        "ports": {},
        "state": "absent"
       }
      },
      "members": [
       "station"
      ],
      "selected": [],
      "state": "present"
     },
     "origin": "network",
     "targets": {
      "layout:7b2269223a302c226a223a302c226b696e64223a226c617474696365227d": "node",
      "layout:7b2269223a312c226a223a302c226b696e64223a226c617474696365227d": "node",
      "station": "server"
     }
    },
    {
     "code_count": 3,
     "descriptor": {
      "kind": "membership",
      "path": [
       "overrides"
      ]
     },
     "observed": {
      "members": [],
      "state": "absent"
     },
     "origin": "network",
     "targets": {
      "station": "server"
     }
    },
    {
     "code_count": 3,
     "descriptor": {
      "kind": "value",
      "path": [
       "placements",
       "station",
       "footprint",
       "width"
      ]
     },
     "observed": {
      "eligible": true,
      "state": "present",
      "unset": [],
      "value": 2
     },
     "origin": "model",
     "targets": {
      "layout:7b2269223a302c226a223a302c226b696e64223a226c617474696365227d": "node",
      "layout:7b2269223a312c226a223a302c226b696e64223a226c617474696365227d": "node",
      "station": "server"
     }
    }
   ],
   "sealed": true
  },
  "diagnostics": [
   {
    "code": "orphan-placement",
    "message": "placement target is absent",
    "path": [
     "placements",
     "ghost"
    ],
    "related_paths": [],
    "severity": "warning",
    "stage": null,
    "target": "ghost"
   }
  ],
  "full_hash": "158ca3bea77f8d8650574b2e00b0565a88486ee89aacf29475b59652fb800511",
  "layers": {
   "code": [
    [
     "declare",
     {
      "grid": {
       "dx": 2,
       "dy": 2,
       "origin": [
        0,
        0,
        0
       ]
      },
      "schema_version": "1.0"
     }
    ],
    [
     "declare",
     {
      "network": {
       "blocked": {},
       "bounds": [
        0,
        0,
        2,
        0
       ],
       "capacity": 2,
       "clearance": 0,
       "direction": "both",
       "enabled": true,
       "neighbors": 4,
       "type": "lattice"
      },
      "schema_version": "1.0"
     }
    ],
    [
     "stations",
     {
      "placements": {
       "station": {
        "footprint": {
         "width": 2
        },
        "kind": "server",
        "position": [
         0,
         3,
         0
        ],
        "visual": {
         "color": "#112233"
        }
       }
      },
      "schema_version": "1.0"
     }
    ]
   ],
   "file": {
    "placements": {
     "ghost": {
      "kind": "server",
      "visual": {
       "label": "ignored"
      }
     }
    },
    "schema_version": "1.0"
   }
  },
  "layers_hash": "b193c08634a21f125fff1cbff7f61418583444cc4cf39d971b67cda6ff6f164a",
  "leaves": [
   {
    "path": [
     "grid"
    ],
    "schema_default": false,
    "source": {
     "kind": "code",
     "stage": "declare"
    },
    "state": "present"
   },
   {
    "path": [
     "grid",
     "dx"
    ],
    "schema_default": false,
    "source": {
     "kind": "code",
     "stage": "declare"
    },
    "state": "present"
   },
   {
    "path": [
     "grid",
     "dy"
    ],
    "schema_default": false,
    "source": {
     "kind": "code",
     "stage": "declare"
    },
    "state": "present"
   },
   {
    "path": [
     "grid",
     "origin"
    ],
    "schema_default": false,
    "source": {
     "kind": "code",
     "stage": "declare"
    },
    "state": "present"
   },
   {
    "path": [
     "grid",
     "origin",
     "0"
    ],
    "schema_default": false,
    "source": {
     "kind": "code",
     "stage": "declare"
    },
    "state": "present"
   },
   {
    "path": [
     "grid",
     "origin",
     "1"
    ],
    "schema_default": false,
    "source": {
     "kind": "code",
     "stage": "declare"
    },
    "state": "present"
   },
   {
    "path": [
     "grid",
     "origin",
     "2"
    ],
    "schema_default": false,
    "source": {
     "kind": "code",
     "stage": "declare"
    },
    "state": "present"
   },
   {
    "path": [
     "network"
    ],
    "schema_default": false,
    "source": {
     "kind": "code",
     "stage": "declare"
    },
    "state": "present"
   },
   {
    "path": [
     "network",
     "blocked"
    ],
    "schema_default": false,
    "source": {
     "kind": "code",
     "stage": "declare"
    },
    "state": "present"
   },
   {
    "path": [
     "network",
     "bounds"
    ],
    "schema_default": false,
    "source": {
     "kind": "code",
     "stage": "declare"
    },
    "state": "present"
   },
   {
    "path": [
     "network",
     "bounds",
     "0"
    ],
    "schema_default": false,
    "source": {
     "kind": "code",
     "stage": "declare"
    },
    "state": "present"